{"schema_version":"seo-intelligence-v1.1","intelligence_version":"phase-3a.0","generated_at":"2026-09-13T00:00:00.000Z","source_observation_ids":["controlled-query","metric-controlled"],"configuration_version":"phase-3a-fixtures-v1","observed":{"query":{"id":"controlled-query","originalQuery":"best accounting software for small business","normalizedQuery":"best accounting software for small business","language":"en","region":"US"},"signals":[{"type":"OBSERVED_ORGANIC_SERP_QUERY","evidence":{"category":"SEARCH_OBSERVED"}}],"competitors":[]},"derived":{"demand":"VALIDATED","intent":{"intent":"commercial_investigation","confidence":0.7,"basis":["comparison term"],"evidenceRefs":["controlled-search"],"category":"DERIVED"},"commercialSignals":[{"type":"comparison","matchedBasis":"comparison term","confidence":0.65,"source":"DETERMINISTIC"}],"problemSignals":[],"jtbd":{"actor":null,"task":null,"desiredOutcome":null,"constraint":null,"basis":"INFERRED","evidenceRefs":["controlled-search"]},"opportunity":{"id":"controlled-opportunity","demandState":"VALIDATED","confidence":"PROMISING"}},"model_inferred":[],"unknowns":[],"contradictions":[],"next_validation_actions":[{"type":"INSPECT_TOP_COMPETITORS","reason":"Metric-backed demand requires independent competitor inspection.","evidenceRefs":["metric-controlled"]}],"keyword_metric_observations":[{"id":"metric-controlled","provider":"dataforseo","market":"US","language":"en","searchVolume":{"status":"PRESENT","value":120},"cpc":{"status":"PRESENT","value":2.5},"paidAdvertiserCompetition":{"status":"PRESENT","value":42},"evidence":{"family":"KEYWORD_METRIC","rawArtifactRef":"evidence/keyword_metric/dataforseo/controlled.json","sha256":"aaaaaaaaaaaaaaaaaaaaaaaaaaaaaaaaaaaaaaaaaaaaaaaaaaaaaaaaaaaaaaaa","captureId":"controlled-capture"}}]}
